<?xml version="1.0"?>
<!-- 
Zigbee Alliance owns the copyright to the text and content displayed or 
included in this document (including in PDF, XML files and other formats) in 
all forms of media, which copyright is protected by the copyright laws of the 
United States and by international treaties.  Full text of licensing terms 
applicable to this document can be found in the LICENSE.md file.
-->
<zcl:cluster xmlns:zcl="http://zigbee.org/zcl/clusters"
  xmlns:xsi="http://www.w3.org/2001/XMLSchema-instance"
  xmlns:type="http://zigbee.org/zcl/types"
  xmlns:xi="http://www.w3.org/2001/XInclude"
  xsi:schemaLocation="http://zigbee.org/zcl/clusters cluster.xsd http://zigbee.org/zcl/types type.xsd"
  id="0600" revision="0" name="Generic Tunnel">
  <classification role="application" picsCode="TUN" primaryTransaction="" />
  <server>
    <attributes>
      <attribute id="0001" name="MaximumIncomingTransferSize" type="uint16" required="true" max="65535" default="0" />
      <attribute id="0002" name="MaximumOutgoingTransferSize" type="uint16" required="true" max="65535" default="0" />
      <attribute id="0003" name="ProtocolAddress" type="octstr" writable="true" required="true" default="Null string">
        <restriction>
          <type:minLength value="0" />
          <type:maxLength value="255" />
        </restriction>
      </attribute>
    </attributes>
  </server>
</zcl:cluster>
